{
  "schema_version": "riley.vllm-profile-run.v1",
  "role": "candidate",
  "pair_index": 3,
  "run_id": "g04-riley-3",
  "recorded_at_utc": "2026-09-11T14:29:36Z",
  "status": "success",
  "failure_count": 0,
  "source": {
    "git_commit": "59f02242a2993b698d5f1c6b970b96bad66fb0a4",
    "git_dirty": false,
    "executable_sha256": "bcc0230a559e8bf4069f9da89927b5fd8a5706413dde08c5dc456c9c86a13c43",
    "implementation_id": "g04-vllm-smol-p128-v1",
    "runtime_flag": {
      "name": "graph_numerics",
      "value": "vllm-smol-p128-v1"
    },
    "semantic_class": "VLLM_REFERENCE",
    "correctness_gate_id": "g04-vllm-smol-p128-v1",
    "correctness_report_sha256": "8fb6d15ca85a23d424c05c7cbc3c23c4a2885b77869a43ec332adeeddbc47807"
  },
  "environment": {
    "gpu": {
      "model": "NVIDIA GeForce RTX 4090",
      "uuid": "GPU-9087e425-6aca-b722-b8c9-cc0423b39fb0",
      "device_index": 0,
      "pci_bus_id": "00000000:01:00.0",
      "compute_capability": "8.9",
      "vram_bytes": 25757220864
    },
    "host": {
      "environment_id": "rtx4090-ubuntu22-driver580-20260911-v2",
      "cpu_model": "13th Gen Intel(R) Core(TM) i7-13700K",
      "physical_core_count": 16,
      "logical_core_count": 24,
      "ram_bytes": 67185594368,
      "os_release": "Ubuntu 22.04.5 LTS",
      "kernel_release": "6.8.0-138-generic",
      "architecture": "x86_64"
    },
    "software": {
      "nvidia_driver_version": "580.173.02",
      "cuda_runtime_version": "13.0",
      "cuda_toolkit_version": "Cuda compilation tools, release 13.3, V13.3.73",
      "cublas_version": "13.1.1",
      "container_image_sha256": null
    }
  },
  "workload": {
    "workload_id": "g04-c1-p128-o32",
    "model_id": "HuggingFaceTB/SmolLM2-135M",
    "model_revision": "93efa2f097d58c2a74874c7e644dbc9b0cee75a2",
    "weights_sha256": "80521b40281d6ce74e35c9282c22539e75aa0ac8578892b2a59955ef78d55da1",
    "tokenizer_sha256": "9ca9acddb6525a194ec8ac7a87f24fbba7232a9a15ffa1af0c1224fcd888e47c",
    "dtype": "bf16",
    "concurrency": 1,
    "prompt_tokens": 128,
    "output_tokens": 32,
    "warmups": 5,
    "measured_iterations": 30,
    "sampling_id": "greedy",
    "seed": null
  },
  "trace": {
    "capacity": 4800,
    "retained_records": 4800,
    "dropped_records": 0
  },
  "primary_metric": "aggregate.host.execute_ns",
  "aggregate": {
    "host": {
      "plan_ns": {
        "validity": "measured",
        "value": 3599447
      },
      "execute_ns": {
        "validity": "measured",
        "value": 15195820650
      },
      "sampling_ns": {
        "validity": "measured",
        "value": 181041
      },
      "commit_ns": {
        "validity": "measured",
        "value": 1447626
      }
    },
    "cuda": {
      "stream_span_ns": {
        "validity": "unmeasured",
        "value": null
      },
      "idle_ns": {
        "validity": "unmeasured",
        "value": null
      }
    },
    "counters": {
      "iterations": {
        "validity": "measured",
        "value": 4770
      },
      "kernel_launches": {
        "validity": "unmeasured",
        "value": null
      },
      "copies": {
        "h2d_calls": {
          "validity": "unmeasured",
          "value": null
        },
        "h2d_bytes": {
          "validity": "unmeasured",
          "value": null
        },
        "d2h_calls": {
          "validity": "unmeasured",
          "value": null
        },
        "d2h_bytes": {
          "validity": "unmeasured",
          "value": null
        }
      },
      "allocations": {
        "device_allocations": {
          "validity": "unmeasured",
          "value": null
        },
        "device_frees": {
          "validity": "unmeasured",
          "value": null
        },
        "pinned_allocations": {
          "validity": "unmeasured",
          "value": null
        },
        "pinned_frees": {
          "validity": "unmeasured",
          "value": null
        },
        "peak_device_bytes": {
          "validity": "unmeasured",
          "value": null
        }
      }
    },
    "throughput_output_tokens_per_second": 63.15076348673123
  },
  "requests": [
    {
      "input_index": 0,
      "prompt_u32le_sha256": "9c517926bf0e7df0c944a4a02da912a0541c060b7a9995ca863bedb3fe9ba372",
      "generated_u32le_sha256": "be8cb5992ba0d835b7c1a518448cab1aa858934bbc99726270ce29f3e02c78f9",
      "prompt_token_count": 128,
      "requested_output_token_count": 32,
      "generated_token_count": 32,
      "ttft_ms": 435.382116,
      "tpot_ms": 2.3043030322580647,
      "e2e_ms": 506.81551
    },
    {
      "input_index": 1,
      "prompt_u32le_sha256": "9c517926bf0e7df0c944a4a02da912a0541c060b7a9995ca863bedb3fe9ba372",
      "generated_u32le_sha256": "be8cb5992ba0d835b7c1a518448cab1aa858934bbc99726270ce29f3e02c78f9",
      "prompt_token_count": 128,
      "requested_output_token_count": 32,
      "generated_token_count": 32,
      "ttft_ms": 435.24702,
      "tpot_ms": 2.3059870967741936,
      "e2e_ms": 506.73262
    },
    {
      "input_index": 2,
      "prompt_u32le_sha256": "9c517926bf0e7df0c944a4a02da912a0541c060b7a9995ca863bedb3fe9ba372",
      "generated_u32le_sha256": "be8cb5992ba0d835b7c1a518448cab1aa858934bbc99726270ce29f3e02c78f9",
      "prompt_token_count": 128,
      "requested_output_token_count": 32,
      "generated_token_count": 32,
      "ttft_ms": 435.195712,
      "tpot_ms": 2.3043765483870966,
      "e2e_ms": 506.631385
    },
    {
      "input_index": 3,
      "prompt_u32le_sha256": "9c517926bf0e7df0c944a4a02da912a0541c060b7a9995ca863bedb3fe9ba372",
      "generated_u32le_sha256": "be8cb5992ba0d835b7c1a518448cab1aa858934bbc99726270ce29f3e02c78f9",
      "prompt_token_count": 128,
      "requested_output_token_count": 32,
      "generated_token_count": 32,
      "ttft_ms": 435.282556,
      "tpot_ms": 2.304500387096774,
      "e2e_ms": 506.722068
    },
    {
      "input_index": 4,
      "prompt_u32le_sha256": "9c517926bf0e7df0c944a4a02da912a0541c060b7a9995ca863bedb3fe9ba372",
      "generated_u32le_sha256": "be8cb5992ba0d835b7c1a518448cab1aa858934bbc99726270ce29f3e02c78f9",
      "prompt_token_count": 128,
      "requested_output_token_count": 32,
      "generated_token_count": 32,
      "ttft_ms": 435.349611,
      "tpot_ms": 2.305485387096774,
      "e2e_ms": 506.819658
    },
    {
      "input_index": 5,
      "prompt_u32le_sha256": "9c517926bf0e7df0c944a4a02da912a0541c060b7a9995ca863bedb3fe9ba372",
      "generated_u32le_sha256": "be8cb5992ba0d835b7c1a518448cab1aa858934bbc99726270ce29f3e02c78f9",
      "prompt_token_count": 128,
      "requested_output_token_count": 32,
      "generated_token_count": 32,
      "ttft_ms": 435.353831,
      "tpot_ms": 2.3048774193548387,
      "e2e_ms": 506.805031
    },
    {
      "input_index": 6,
      "prompt_u32le_sha256": "9c517926bf0e7df0c944a4a02da912a0541c060b7a9995ca863bedb3fe9ba372",
      "generated_u32le_sha256": "be8cb5992ba0d835b7c1a518448cab1aa858934bbc99726270ce29f3e02c78f9",
      "prompt_token_count": 128,
      "requested_output_token_count": 32,
      "generated_token_count": 32,
      "ttft_ms": 435.367283,
      "tpot_ms": 2.304661129032258,
      "e2e_ms": 506.811778
    },
    {
      "input_index": 7,
      "prompt_u32le_sha256": "9c517926bf0e7df0c944a4a02da912a0541c060b7a9995ca863bedb3fe9ba372",
      "generated_u32le_sha256": "be8cb5992ba0d835b7c1a518448cab1aa858934bbc99726270ce29f3e02c78f9",
      "prompt_token_count": 128,
      "requested_output_token_count": 32,
      "generated_token_count": 32,
      "ttft_ms": 435.273789,
      "tpot_ms": 2.305812064516129,
      "e2e_ms": 506.753963
    },
    {
      "input_index": 8,
      "prompt_u32le_sha256": "9c517926bf0e7df0c944a4a02da912a0541c060b7a9995ca863bedb3fe9ba372",
      "generated_u32le_sha256": "be8cb5992ba0d835b7c1a518448cab1aa858934bbc99726270ce29f3e02c78f9",
      "prompt_token_count": 128,
      "requested_output_token_count": 32,
      "generated_token_count": 32,
      "ttft_ms": 435.065533,
      "tpot_ms": 2.3032489032258066,
      "e2e_ms": 506.466249
    },
    {
      "input_index": 9,
      "prompt_u32le_sha256": "9c517926bf0e7df0c944a4a02da912a0541c060b7a9995ca863bedb3fe9ba372",
      "generated_u32le_sha256": "be8cb5992ba0d835b7c1a518448cab1aa858934bbc99726270ce29f3e02c78f9",
      "prompt_token_count": 128,
      "requested_output_token_count": 32,
      "generated_token_count": 32,
      "ttft_ms": 435.209529,
      "tpot_ms": 2.3053231612903224,
      "e2e_ms": 506.674547
    },
    {
      "input_index": 10,
      "prompt_u32le_sha256": "9c517926bf0e7df0c944a4a02da912a0541c060b7a9995ca863bedb3fe9ba372",
      "generated_u32le_sha256": "be8cb5992ba0d835b7c1a518448cab1aa858934bbc99726270ce29f3e02c78f9",
      "prompt_token_count": 128,
      "requested_output_token_count": 32,
      "generated_token_count": 32,
      "ttft_ms": 435.252066,
      "tpot_ms": 2.3050902580645163,
      "e2e_ms": 506.709864
    },
    {
      "input_index": 11,
      "prompt_u32le_sha256": "9c517926bf0e7df0c944a4a02da912a0541c060b7a9995ca863bedb3fe9ba372",
      "generated_u32le_sha256": "be8cb5992ba0d835b7c1a518448cab1aa858934bbc99726270ce29f3e02c78f9",
      "prompt_token_count": 128,
      "requested_output_token_count": 32,
      "generated_token_count": 32,
      "ttft_ms": 435.247244,
      "tpot_ms": 2.30351564516129,
      "e2e_ms": 506.656229
    },
    {
      "input_index": 12,
      "prompt_u32le_sha256": "9c517926bf0e7df0c944a4a02da912a0541c060b7a9995ca863bedb3fe9ba372",
      "generated_u32le_sha256": "be8cb5992ba0d835b7c1a518448cab1aa858934bbc99726270ce29f3e02c78f9",
      "prompt_token_count": 128,
      "requested_output_token_count": 32,
      "generated_token_count": 32,
      "ttft_ms": 435.491464,
      "tpot_ms": 2.3048103870967744,
      "e2e_ms": 506.940586
    },
    {
      "input_index": 13,
      "prompt_u32le_sha256": "9c517926bf0e7df0c944a4a02da912a0541c060b7a9995ca863bedb3fe9ba372",